{
  "schema_version": "datapan.runtime-freshness-import-admission.v1",
  "admitted_at": "2026-09-26T00:07:49.236924Z",
  "run_id": "36202899918",
  "producer": {
    "repository": "StatPan/datapan-registry",
    "revision": "44aaf067056c6ba231685ca9284a3cfbcd861ca5",
    "run_id": "36202899918",
    "run_url": "https://github.com/StatPan/datapan-registry/actions/runs/36202899918"
  },
  "inputs": {
    "sanitized_report_sha256": "52863a397815f6f572c634cfba2c00931035523f7500f7f4afaeb8fe82011b24",
    "run_receipt_sha256": "f1b9d2d5e9c4588f2381727c6c816394c49c5e773f65f5475786c41dcb55f856",
    "import_receipt": {
      "path": "reports/runtime-freshness-imports/36202899918.json",
      "sha256": "0b4aa8bcfb57f5daab150a86ae910f749e8c0b8b45f86cc4ea38c1c5b478c296"
    },
    "planned_identity_set": {
      "count": 800,
      "sha256": "77c4126e4c99fbcf54a04451a49a5ab891b5f2723145c9cb39db7db4f20c81c7"
    }
  },
  "outcome": "imported",
  "arithmetic": {
    "before": {
      "total": 5582,
      "verified": 2900,
      "failed": 486,
      "skipped": 2196,
      "unknown": 0
    },
    "selected": {
      "total": 226,
      "verified": 154,
      "failed": 71,
      "skipped": 1,
      "unknown": 0
    },
    "after": {
      "total": 5808,
      "verified": 3054,
      "failed": 557,
      "skipped": 2197,
      "unknown": 0
    },
    "selected_new_results": 226
  },
  "selected_identity_set": {
    "count": 226,
    "sha256": "7d782ff4b14c03df0040513ed158e6e7053c36e867a779cb8b4d51e18f0fded5"
  }
}
