{
  "schema_version": "datapan.runtime-freshness-import-admission.v1",
  "admitted_at": "2026-09-30T01:45:58.529244Z",
  "run_id": "36650152644",
  "producer": {
    "repository": "StatPan/datapan-registry",
    "revision": "4321df1868754045ff3705b5c133c9fad2abde6e",
    "run_id": "36650152644",
    "run_url": "https://github.com/StatPan/datapan-registry/actions/runs/36650152644"
  },
  "inputs": {
    "sanitized_report_sha256": "1587e240776c2634828178bee379941c144a5e35f50144f83336f26bc6d127a0",
    "run_receipt_sha256": "5f1dad9051dd3c4084da4581edc40833276702dde4d3d4c5ff7e81004a90260c",
    "import_receipt": {
      "path": "reports/runtime-freshness-imports/36650152644.json",
      "sha256": "e292bcedf341209be97c9f1984bead09768dd1954fe58ff8b404e2596cd681a1"
    },
    "planned_identity_set": {
      "count": 800,
      "sha256": "4e63d29b742385fbb26b5d9e4aec7ed98fcf92950cfeb9b407d3878e9ece4cb4"
    }
  },
  "outcome": "imported",
  "arithmetic": {
    "before": {
      "total": 6381,
      "verified": 3519,
      "failed": 541,
      "skipped": 2321,
      "unknown": 0
    },
    "selected": {
      "total": 800,
      "verified": 58,
      "failed": 405,
      "skipped": 337,
      "unknown": 0
    },
    "after": {
      "total": 7181,
      "verified": 3577,
      "failed": 946,
      "skipped": 2658,
      "unknown": 0
    },
    "selected_new_results": 800
  },
  "selected_identity_set": {
    "count": 800,
    "sha256": "4e63d29b742385fbb26b5d9e4aec7ed98fcf92950cfeb9b407d3878e9ece4cb4"
  }
}
